Unnamed: 0,rating,user_id,reviewText,categories,item_id,unixReviewTime,reviewTime,gps,price,dtime,hour,minute,second,sentiment score,sentiment_label,sentiment_numeric
0,4,2623125,Best War Wanton soup in Red Bluff,"['Asian Restaurant', 'Chinese Restaurant']",6494903,1394669496,3/12/2014,"[40.179159, -122.236162]",$$$,3/13/2014 0:11,0,11,36,0.893050698,positive,1
1,5,2623125,"This is a review that is long overdo. I've been enjoying the great pizza at this restaurant for over a year now and it's hands down the best in town. I saw a review on here saying the pizza was greasy, and I'll bet it was for a peperoni pizza. I don't know how you could put so many slices of peperoni on, where you can't even see the cheese, without a little pepperoni grease escaping. These guys at Firehouse make the pizzas that everyone else does in their commercials, you can watch as they pile the toppings a mile high on every pie. And when was the last time you saw someone slicing bell peppers and tomatoes by hand for your pizza. I honestly have a hard time understanding how these guys stay in business, but I'm glad they do. And the five dollar slice and soda lunch is probably the best value in town. Thanks guys, keep it up.","['European Restaurant', 'Italian Restaurant', 'Pizza Restaurant']",328045,1394826388,3/14/2014,"[40.178074, -122.235234]",$$,3/14/2014 19:46,19,46,28,0.311134706,positive,1
2,5,2623125,"Long time favorite Mexican food, always consistent and great tasting.",['Mexican Restaurant'],5192564,1394669713,3/12/2014,"[40.175064, -122.242574]",$$,3/13/2014 0:15,0,15,13,0.944869079,positive,1
3,5,6066497,Great coffee and location! Check out the used book store across the street,"['Espresso Bar', 'Coffee Shop']",2895067,1379187049,9/14/2013,"[38.030536, -121.884024]",$$$,9/14/2013 19:30,19,30,49,0.867263925,positive,1
4,5,6066497,"I've been here dozens of times, and I'll keep coming back. I really like the usuzukari and the Bruce roll","['Sushi Restaurant', 'Asian Restaurant', 'Japanese Restaurant']",4239194,1394848761,3/14/2014,"[37.961078, -121.748886]",$$,3/15/2014 1:59,1,59,21,0.617629894,positive,1
5,3,1897485,"Finally came back to this place after so many years, atmosphere was ok anyways I ordered two shrimp tacos and a lobster taco. My shrimp tacos had about only 2-3 shrimps the rest was soggy bell peppers and a broken up corn tortilla, my lobster taco was a lil better.","['Latin American Restaurant', 'Mexican Restaurant', 'Seafood Restaurant']",9264434,1347079555,9/7/2012,"[33.20043, -117.331493]",$$$,9/8/2012 4:45,4,45,55,-0.035447124,neutral,0
6,5,1897485,I live in sandiego its about an hour drive and every time we go its worth it to the last bite. Yummm. Wish their was one closer.,['Chicken Restaurant'],7102951,1388002613,12/25/2013,"[33.680515, -117.90633]",$$$,12/25/2013 20:16,20,16,53,0.377268037,positive,1
7,2,1897485,"I ordered 4 rolled tacos. when I received them, I got a lot of guacamole just smothered on my tacos. A little bit of yellow cheese, where's the lettuce sourcream and salsa fresca Service was great toobad for the food.","['Mexican Restaurant', 'Latin American Restaurant']",8461225,1324327546,12/19/2011,"[33.131197, -117.260452]",$$$,12/19/2011 20:45,20,45,46,-0.031696773,neutral,0
8,3,7962893,"WELL I HAVE EATEN HERE SEVERAL TIMES AND EVERYTHING IS GREAT, I  TRIED TO HAVE A LARGE PARTY (18 PEOPLE) SO I CALLED A DAY AHEAD TO MAKE A RESERVATION AND THEY SAID THEY DONT TAKE RESERVATION AND I COULD COME 1-2 HOURS BEFORE I WANTED TO DINE AND THEY COULD DO IT THAT WAY.   SERIOUSLY? I WANT TO BRING A 18 PERSON PARTY TO YOUR ESTABLISHMENT AND YOU WANT ME TO WAIT FOR 2 HOURS BEFORE? ILL TAKE MY MONEY SOMEWHERE ELSE...","['American Restaurant', 'Dessert Restaurant']",1806688,1352400948,11/8/2012,"[34.112, -117.535357]",$$,11/8/2012 18:55,18,55,48,-0.215042422,neutral,0
9,5,9872657,The service is good and they are nice. Everything I've tried at Lotus has been great.,"['Vegetarian Restaurant', 'Eclectic Restaurant', 'Cafe']",5833083,1308018773,6/13/2011,"[33.042048, -117.29286]",$$,6/14/2011 2:32,2,32,53,0.704599488,positive,1
10,1,5118821,"Have been going to this restaurant for years and always enjoyed fresh sliced turkey dinner with the sides and pie for dessert for a reasonable price.  On this Thanksgiving Day all four in our party ordered the above but received pressed turkey, cold and uncooked yams served in little cut up squares, uncooked veggies.  It was terrible and we sent it back and ordered the fresh cut ham but it was canned ham and the sides were the same as above.  They would not allow us to order from the regular menu and the charge for this terrible dinner was $24.95 each.  The apple pie tasted okay. They have lost mine and my entire family's business.  I know these had to be different owners than the ones in the past.  The staff was all Asian, either Chinese or Japanese so perhaps they just do not know how to run an American restaurant.  Of course I love both Chinese and Japanese food but not when I expect American food in an American restaurant on an American Thanksgiving Day.  Thank you for allowing me to express my opinion and disappointment in this traditional meal that my family and I have enjoyed for years there in the past.","['American Restaurant', 'Bakery']",9206292,1385860482,11/30/2013,"[34.152491, -118.454241]",$$,12/1/2013 1:14,1,14,42,-0.573978771,negative,-1
11,5,4234285,"Nice small atmosphere, minimalist design, great beer. This is a great place to try a sampler flight if you've never been. Brewed on-location. As far as food is concerned, it isn't much. Try all the brews and you'll like (at the very least) one of them. +1 for Nitro Solidarity.",['Nightlife'],1788197,1354000956,11/26/2012,"[34.115102, -118.243501]",$$,11/27/2012 7:22,7,22,36,0.68047565,positive,1
12,3,4234285,"I ordered four tacos to go, drove home and found my order made completely wrong. It was too far to go back and re-order.   Advice for any vegetarians wishing to dine here: *make sure* you say no meat, probably twice, instead of saying ""I'd like only veg items x, y and z"". Because they did give me x, y and z, only on top of a mountain of beef.  Other times, the food has been okay and the service isn't bad (at least at the counter). As a plus, they did charge me the 75 cents for a meatless taco. Could've been worse, could've been way better.","['Mexican Restaurant', 'Latin American Restaurant']",8097736,1354000521,11/26/2012,"[34.130254, -118.252288]",$$,11/27/2012 7:15,7,15,21,-0.522173781,negative,-1
13,5,1549476,"Hoity toity country market in a perfect, oddly non-redneck setting","['American Restaurant', 'Deli', 'Food Products Supplier']",6874635,1311509170,7/24/2011,"[38.668615, -122.817146]",$$,7/24/2011 12:06,12,6,10,0.684832105,positive,1
14,5,3082165,Excellent Fresh Mexican food for the health choice options.  Ray Schmidt,"['Mexican Restaurant', 'Latin American Restaurant', 'Fast Food Restaurant']",2645441,1378408333,9/5/2013,"[34.260105, -119.234134]",$$$,9/5/2013 19:12,19,12,13,0.899313661,positive,1
15,4,2381911,"Gap always has a jean that fits awesomely, i wish their prices were a bit competitive in comparison to their outlets, also the amount of the pieces they have in store sometimes fly so quick that is hard to find an specific size with their best sellers, but in general i really like this store and most of their products.","['Clothing Store', ""Women's Clothing Store"", ""Children's Clothing Store""]",6958612,1355436757,12/13/2012,"[37.784711, -122.407447]",$$,12/13/2012 22:12,22,12,37,0.57538865,positive,1
16,4,2381911,"I like the wide range macy's has in their store, however their service is not quite as good, maybe cause the store is so big, also i wish they were more attentive to the dresser area. In general they usually have good prices for dresses and i like the little starbucks inside the store.","['Department Store', ""Men's Clothing Store""]",6117386,1355437030,12/13/2012,"[37.786801, -122.407638]",$$,12/13/2012 22:17,22,17,10,0.123152791,neutral,0
17,5,2381911,"I love the guys that work at this store, they are always very friendly, smiley and happy to serve, they are also very quick with their tasks. Besides that the juices and snacks they have are really good",['Juice Shop'],9500815,1355436832,12/13/2012,"[37.787559, -122.401067]",$$$,12/13/2012 22:13,22,13,52,0.878957481,positive,1
18,4,2381911,"I like browsing at nordstrom, but today while looking for a product at their chanel stand i felt the staff they had there wasn't as good, he didn't recommend me anything else or help me much with my selection of the lipstick i was looking for, their products are amazing yes, but i wish they were more helpful.",['Clothing Store'],8024660,1355436447,12/13/2012,"[37.784143, -122.407361]",$$,12/13/2012 22:07,22,7,27,-0.123729752,neutral,0
19,4,2381911,"I like the boulange pretty much at any of their locations, however this one always kills me a bit with their closed add because i feel is a bit -tough- on the clients, besides that they are pretty nice and friendly all day and their food is yummy","['Restaurant', 'Bakery', 'Cafe']",7661847,1355436317,12/13/2012,"[37.787736, -122.403049]",$$,12/13/2012 22:05,22,5,17,0.385598617,positive,1
20,5,2381911,"Sephora is a great store, i always think of back home and tell myself i wish we had sephora in my country, their staff is always helpful and smiley, their products are wide in range and they always have something nice for just anybody.  I wish their perfume selection was wider but i think the store is very complete in general.",['Cosmetics Store'],6146633,1355436651,12/13/2012,"[37.784983, -122.407872]",$,12/13/2012 22:10,22,10,51,0.841234777,positive,1
21,4,2381911,"The people at the dressBarn helped me finding a nice dress for a wedding, the prices they have are accesible and good in comparison to other stores, they always have something good in the store.","[""Women's Clothing Store""]",5225073,1355436076,12/13/2012,"[37.792145, -122.402735]",$$,12/13/2012 22:01,22,1,16,0.686160572,positive,1
22,1,9951785,"Veronica in the pharmacy department is EXTREMELY RUDE AND UNPROFESSIONAL! She showed no compassion towards me after having 2 spine surgeries she jumped to conclusions and made accusations of me being a med seeker, when really i have had 2 unsuccessful back surgeries and am in constant pain. She does not deserve a job in healthcare. When I called back to speak with a manager Veronica hung up on me and said some very rude 4 letter words to me before she hung up.","['Pharmacy', 'Photo Shop', 'Variety Store']",1930703,1393367475,2/25/2014,"[34.425417, -117.325115]",$$,2/25/2014 22:31,22,31,15,-0.583570447,negative,-1
23,5,2656996,"Hands down, the BEST Pizza in town !!!  Get the NY Style Pizza - they use fresh cheese, homemade sauce and delicious toppings. My favorite is actually the regular cheese pizza, but also try the pesto, white cheese, meatball.....and others. They are all delish!  You can also order by the slice or a whole pizza pie.  The cool chic - Lily is always working hard and delivers excellent customer service, every single time I'm there! And Andrea and the rest of the staff and owner are super friendly, treat you like family, and quick w/ service. Small family-owned businesses are the best.  Small cool restaurant.... and that's all you need.  Come in and try these guys out... you will not be disappointed.","['Pizza Restaurant', 'European Restaurant', 'Italian Restaurant']",948933,1379534695,9/18/2013,"[34.086451, -118.376277]",$$,9/18/2013 20:04,20,4,55,0.960520501,positive,1
24,5,2656996,"OMG... Burger Lounge is the Absolute BEST Burger joint in town!  I always get the yummy Lounge Burger w/ American Cheddar, lettuce, tomatoes, sauce, cooked medium.  And fresh french fries w/ ranch dressing. Yumm!  AND it's Grass-Fed Beef.  That's what beef is suppose to be - grass-fed, lean, delicious.  Everything is made ""Fresh - Made To Order"" !!!  They do not cook it, till you order it.  And that's what real food is suppose to be.  I also like the fact that their pop is organic w/ cane sweetened real sugar. That's what real pop is.   None of that processed corn syrup crap.  AND absolutely great customer service from Romel, dude who looks like Ed Norton, and the rest of the staff rocks!  They always make sure I'm completely satisfied, refill and bring over extras to make you happy.  The fresh local food, excellent customer service and great ambience and vibe, -- has made me a regular customer.  Thx Burger Lounge... You guys rock!","['Hamburger Restaurant', 'Fast Food Restaurant', 'American Restaurant']",6485108,1378960018,9/11/2013,"[34.09375, -118.377878]",$$$,9/12/2013 4:26,4,26,58,0.745849933,positive,1
25,2,2075116,"Unfortunately my pizza was overcooked. The kids were picking off the burnt pepperoni. Apparently the cheesey bread has mayo on it and not butter. This was my first time ordering over the phone with this pizzeria. $40 for pizza, pop, and bread. Tip included. Not a good meal.","['Pizza Restaurant', 'European Restaurant', 'Delivery Restaurant']",7498056,1356723179,12/28/2012,"[40.804633, -124.154519]",$$,12/28/2012 19:32,19,32,59,-0.711637917,negative,-1
26,5,739110,Food is pretty good and it's a friendly environment.  They can accommodate if you're in a hurry.,"['Asian Restaurant', 'Chinese Restaurant']",6537906,1395020034,3/16/2014,"[36.673784, -121.655614]",$$,3/17/2014 1:33,1,33,54,0.479263297,positive,1
27,5,1165249,Fantastic food and service!,"['Latin American Restaurant', 'Mexican Restaurant']",9612889,1358185965,1/14/2013,"[35.126212, -118.00204]",$$,1/14/2013 17:52,17,52,45,0.930499599,positive,1
28,4,9374143,Good place to shop,"['Grocery Store', 'Bakery', 'Florist']",3028203,1387057808,12/14/2013,"[38.103714, -122.571613]",$$,12/14/2013 21:50,21,50,8,0.561324714,positive,1
29,4,6163819,"We ordered a seafood kebob plate, a signature lamb with yogurt sauce and rice, and a soup.  We liked everything. I found the lamb to be a bit too rich, and I probably will order something else when I go there next time. But I am glad I tried it.  Honestly you can't find food like this hardly any where else, so when you go, you should try the signature dishes.  The atmosphere was fun, and on a rainy weekday, they were super busy.  that tells you something!","['Middle Eastern Restaurant', 'Mediterranean Restaurant']",1618746,1385074891,11/21/2013,"[37.376215, -122.030151]",$$,11/21/2013 23:01,23,1,31,0.527604167,positive,1
30,3,9500135,I don't see a big difference between Cafe Rio and Chipotle.  A nicer copycat?  Perhaps you can choose it because it doesn't belong to McDonald's like Chipotle? It isn't my kind of Mexican trying-to-look-not-so-fast-food restaurant.,"['Mexican Restaurant', 'Latin American Restaurant', 'Fast Food Restaurant']",7394452,1336450269,5/7/2012,"[33.849094, -118.142714]",$$$,5/8/2012 4:11,4,11,9,-0.172124519,neutral,0
31,4,9500135,"If you have never been in a souplantation, is basically salads,soups,pizza,fruits and coffee buffet. NOT for meat lovers.",['Restaurant'],4333991,1357076004,1/1/2013,"[33.853636, -118.137184]",$$,1/1/2013 21:33,21,33,24,-0.424338956,negative,-1
32,4,9500135,"Very good place. Much better that Benihana and less expensive (still, teppan diner for 2 is at least $50). Scallops are my favorite. The fried rice w/extra garlic is also excellent.","['Japanese Restaurant', 'Asian Restaurant', 'Sushi Restaurant']",3629639,1354328801,11/30/2012,"[33.854174, -118.138261]",$$,12/1/2012 2:26,2,26,41,0.719983334,positive,1
33,4,9500135,"Typical Korean restaurant. Free appetizers and good ""stew/soup"".","['Korean Restaurant', 'Asian Restaurant']",6200350,1345082722,8/15/2012,"[33.816571, -118.306795]",$$$,8/16/2012 2:05,2,5,22,0.440604583,positive,1
34,3,9500135,"Nice lunch, Indian Buffet for about $10","['Indian Restaurant', 'Asian Restaurant', 'South Asian Restaurant']",7793663,1359247983,1/26/2013,"[33.83625, -118.321158]",$$$,1/27/2013 0:53,0,53,3,0.627195343,positive,1
35,4,9500135,"Very good pastrami sandwich, but the corned beef was even better.",['Sandwich Shop'],7047016,1352350749,11/7/2012,"[33.821267, -118.326161]",$$$,11/8/2012 4:59,4,59,9,0.421688854,positive,1
36,3,9500135,It's not bad if you never had  churrascaria before. I tried several and this is last on my list. Extremely limited variety of meat & salads. 1/19/13,"['Brazilian Restaurant', 'Steak House']",4464010,1358656266,1/19/2013,"[33.780776, -116.466109]",$$,1/20/2013 4:31,4,31,6,0.036122561,neutral,0
37,5,9500135,Very good breakfast and huge portions.,['Family Restaurant'],5688238,1354387383,12/1/2012,"[33.832605, -118.160912]",$$,12/1/2012 18:43,18,43,3,0.755413729,positive,1
38,2,9500135,"The service was so bad, we will never go back to THAT subway. Maybe it is because they are the only ones there ...","['Sandwich Shop', 'Fast Food Restaurant']",7425243,1348444215,9/23/2012,"[34.851092, -117.082243]",$$$,9/23/2012 23:50,23,50,15,-0.816063722,negative,-1
39,3,9500135,"Small store, carryout and delivery only.","['Pizza Restaurant', 'European Restaurant']",2556406,1345594255,8/21/2012,"[33.833105, -118.142365]",$$$,8/22/2012 0:10,0,10,55,-0.188582598,neutral,0
40,4,9500135,"I tried for breakfast a few times, the chicken fried steak is always excellent. Nice portions sizes, full cup of coffee all the time (love the service).","['Cafe', 'Diner']",7920964,1359248203,1/26/2013,"[33.781296, -116.466916]",$$$,1/27/2013 0:56,0,56,43,0.911374458,positive,1
41,3,9500135,Not better than denny's  :-(,['American Restaurant'],8374046,1358796924,1/21/2013,"[33.83555, -116.546583]",$$$,1/21/2013 19:35,19,35,24,-0.334026366,negative,-1
42,3,9500135,Unexpected: this place cooks chicken perfectly every time.,"['American Restaurant', 'Steak House']",2792636,1343185727,7/24/2012,"[33.917296, -118.073733]",$$,7/25/2012 3:08,3,8,47,0.933731263,positive,1
43,4,9500135,Good burger,"['Restaurant', 'American Restaurant', 'Diner']",1637956,1342218989,7/13/2012,"[34.638646, -120.453834]",$$,7/13/2012 22:36,22,36,29,0.592956258,positive,1
44,4,9500135,"Little pricey, but good, above average.","['European Restaurant', 'Pizza Restaurant', 'American Restaurant']",5284641,1339891780,6/16/2012,"[33.851686, -118.141021]",$$,6/17/2012 0:09,0,9,40,0.37487955,positive,1
45,5,9500135,Excellent breakfast. Be patient and be sure to write your name on the list.,"['Bakery', 'Restaurant']",4323697,1368290130,5/11/2013,"[33.824086, -118.185171]",$$$,5/11/2013 16:35,16,35,30,0.930074337,positive,1
46,4,9500135,"Always packed for breakfast, huge portions, good quality, good flavor and fair prices. Never disappointed.","['American Restaurant', 'European Restaurant', 'Italian Restaurant']",4338005,1359248986,1/26/2013,"[36.144218, -115.202491]",$$,1/27/2013 1:09,1,9,46,0.802635607,positive,1
47,5,9500135,"Very""modern"": select, customize and order your food with an iPad. Good quality,nice portion size and fast.","['American Restaurant', 'Hamburger Restaurant']",1921903,1344735043,8/11/2012,"[33.862883, -118.092693]",$$,8/12/2012 1:30,1,30,43,0.801139497,positive,1
48,4,9500135,"This place is always busy (you know why). Very good, healthy food, strong coffee (THANK YOU!), fresh ingredients. The bad side? A little expensive and cash only. But I don't care :-)","['Cafe', 'Coffee Shop']",1761501,1336446096,5/7/2012,"[33.771626, -118.148372]",$$$,5/8/2012 3:01,3,1,36,0.656591354,positive,1
49,2,9500135,"Perhaps a bad day, but not worth it. Waited for 1 hour (really, from 7pm to 8pm) for a house salad, one sandwich and a sub par pasta. Still waiting for my drinks: -(",['Restaurant'],6635947,1342236020,7/13/2012,"[34.638238, -120.459051]",$$,7/14/2012 3:20,3,20,20,-0.585763665,negative,-1
50,5,9500135,Baby back ribs and tri tip A++. Service A++. The rest just A :-),['Barbecue Restaurant'],9049745,1368150005,5/9/2013,"[33.756283, -118.120817]",$$,5/10/2013 1:40,1,40,5,0.461949194,positive,1
51,4,9500135,"Good quality, good place, good service. A little expensive.",['American Restaurant'],5760745,1338342216,5/29/2012,"[33.936603, -118.121725]",$$,5/30/2012 1:43,1,43,36,0.479320098,positive,1
52,4,9500135,"Best sushi in Vegas. I go every time I can. Always busy, always good, and I always choose the ""all you can eat"" (you ask the server and they will prepare it for you, so it is fresh, it is NOT buffet style)","['Japanese Restaurant', 'Asian Restaurant', 'Sushi Restaurant']",8780574,1351289603,10/26/2012,"[36.115546, -115.134985]",$$,10/26/2012 22:13,22,13,23,0.949383132,positive,1
53,5,9500135,"Stop looking. Best hamburgers in town. Probably best hamburgers in LA county (yes, it's that good ;-)","['Hamburger Restaurant', 'American Restaurant', 'Barbecue Restaurant']",1067861,1336450575,5/7/2012,"[33.880472, -118.125046]",$$,5/8/2012 4:16,4,16,15,0.644457004,positive,1
54,4,9500135,"I'm surprised about the previous reviews. I never had any problems and I've been there several times in the last few months. Clean (the place is not new, but is clean), awesome pita and hummus, great BLT, endless refills of soda and coffee, my wife told me that the baklava is excellent, so I wonder if the evening staff is different.",['Persian Restaurant'],5513658,1364609348,3/29/2013,"[33.887665, -118.101408]",$$,3/30/2013 2:09,2,9,8,0.734295381,positive,1
55,4,9500135,Baja beach omelet is very good.,['Restaurant'],4995612,1367687422,5/4/2013,"[33.938343, -118.122229]",$$,5/4/2013 17:10,17,10,22,0.668210724,positive,1
56,4,9500135,"Excellent for breakfast, If you are hungry, I recommend you the country mix (chopped ham, potatoes, fried eggs, salsa and melted cheese on top ;-)","['Breakfast Restaurant', 'Brunch Restaurant']",8704818,1359249444,1/26/2013,"[33.773432, -118.152274]",$$,1/27/2013 1:17,1,17,24,0.832268281,positive,1
57,5,9500135,"Good coffee,free wifi,no pressure. Very relaxed :-)",['Coffee Shop'],3737805,1344378407,8/7/2012,"[35.13661, -120.626222]",$$,8/7/2012 22:26,22,26,47,0.751773988,positive,1
58,4,9500135,"Good price, better food. This small place could be twice as expensive and twice as famous if it was located in Beverly Hills. Fresh ingredients, attention to detail and very tasty.","['Asian Restaurant', 'Southeast Asian Restaurant', 'Thai Restaurant']",9387804,1359248689,1/26/2013,"[33.946823, -118.144692]",$$,1/27/2013 1:04,1,4,49,0.237080503,neutral,0
59,4,9500135,"This particular Carrows is better than the average. The other ones may be like Denny's and IHOP. Fast, friendly and good. Cold dishes are cold and hot dishes are hot (should be obvious, but in some places it is not). Never had to return a dish, never had to ask for more coffee",['Restaurant'],77701,1293136435,12/23/2010,"[33.901597, -118.106598]",$$,12/23/2010 20:33,20,33,55,0.549669528,positive,1
60,4,9500135,"Good clam chowder, but not the best.","['Restaurant', 'Seafood Restaurant', 'Cafe']",1318797,1365291562,4/6/2013,"[35.140088, -120.642344]",$$,4/6/2013 23:39,23,39,22,0.173744451,neutral,0
61,4,9500135,"Good hamburger,good potato salad,bad ice tea.","['American Restaurant', 'Fast Food Restaurant', 'Family Restaurant']",1767640,1344462317,8/8/2012,"[34.613945, -120.193658]",$$$,8/8/2012 21:45,21,45,17,0.589973998,positive,1
62,3,9500135,"Big variety and the seafood is good. Quality and cleanliness is just OK for a buffet, but the service is very unfriendly.","['Restaurant', 'Asian Restaurant', 'Chinese Restaurant']",2663259,1297816842,2/15/2011,"[33.902011, -118.110482]",$$$,2/16/2011 0:40,0,40,42,0.049694446,neutral,0
63,5,9500135,"All you can eat good MEAT. Used the have a wider variety, but it's still good.","['Brazilian Restaurant', 'Latin American Restaurant', 'South American Restaurant']",6671257,1345082524,8/15/2012,"[33.782016, -118.131492]",$$,8/16/2012 2:02,2,2,4,0.546650143,positive,1
64,4,9500135,"Above average prices, above average quality and above average sizes. When you ask for ribs is not just the bones, they are meaty!. To me, they are way better than Tony Roma's. Also trust me on this one: pay the $14 for the fried chicken.","['Barbecue Restaurant', 'Caterer', 'Takeout Restaurant']",200338,1336449498,5/7/2012,"[33.883087, -118.125398]",$$,5/8/2012 3:58,3,58,18,0.003498629,neutral,0
65,4,9500135,"More expensive than the average Argentine restaurants, but far better quality. Grilled meat was extremely tender and flavorful.","['Argentinian Restaurant', 'South American Restaurant', 'Bar & Grill']",8157784,1348443501,9/23/2012,"[34.083646, -118.347299]",$$,9/23/2012 23:38,23,38,21,0.044139074,neutral,0
66,4,1623031,Always helpful and friendly. good staff,"['Home Improvement Store', 'Hardware Store', 'Lumber Store']",1182428,1367524710,5/2/2013,"[32.702089, -117.101364]",$$$,5/2/2013 19:58,19,58,30,0.75360492,positive,1
67,5,9216966,"Excellent coffee shop, has Google Wallet paypass pads by the registerars (little hard to see). closes at 8 p.m. not 10 p.m.",['Coffee Shop'],7640750,1369434695,5/24/2013,"[34.423052, -119.704231]",$$$,5/24/2013 22:31,22,31,35,0.877371782,positive,1
68,4,9216966,I took my mother to this lovely place one morning and I was happy with the waffles I got. She also seems satisfied with her eggs and toast. One thing that bothered me was when I got chocolate milk they gave me a lot of whip cream inside the chocolate milk. It was great but for 2 dollars ild like to have just a cup of milk with chocolate.,"['American Restaurant', 'Breakfast Restaurant', 'Family Restaurant']",4393299,1358019906,1/12/2013,"[34.398755, -119.518782]",$$,1/12/2013 19:45,19,45,6,0.536132026,positive,1
69,5,1130074,"Big coffee, big food, little price, love it.","['Diner', 'Family Restaurant', 'Breakfast Restaurant']",2384597,1376791103,8/17/2013,"[37.428329, -121.90989]",$$,8/18/2013 1:58,1,58,23,0.90270934,positive,1
