Unnamed: 0,rating,user_id,reviewText,categories,item_id,unixReviewTime,reviewTime,gps,price,dtime,hour,minute,second,sentiment score,sentiment_label,sentiment_numeric
258,5,7127739,"Experienced this place at the CRAWLOWEEN 2013. This place rocks. Good drinks, friendly bartenders â€“ when I remember it correctly. Can only reco this place.",['Cocktail Bar'],3395148,1395768606,3/25/2014,"[37.796665, -122.422032]",$$,3/25/2014 17:30,17,30,6,0.371935176,positive,1
259,5,7127739,"BLVCK SCALE is an absolutely rad brand â€“ you don't buy just a shirt or a cap or a bag. You buy an attitude and a political one, at that. The guys in the store are on of the nicest guys I ever met: very friendly, very supportive, very chatty (in a good way). If you happen to visit San Francisco and Haigh-Ashbury in special, you HAVE to buy BLVCK SCALE â€“ it is THE brand representing the modern hippie-ish SF in a hippy hop way.",['Stores and Shopping'],4999064,1395763817,3/25/2014,"[37.770086, -122.44566]",$,3/25/2014 16:10,16,10,17,0.30640972,positive,1
260,5,7127739,"Of course: good beers. A nice environtment w/ execellent pub grub. If you want delicious stuff and are in downtown, I reco this spot.",['Irish Pub'],8960478,1395768667,3/25/2014,"[37.787142, -122.397586]",$$,3/25/2014 17:31,17,31,7,0.486349476,positive,1
261,5,7127739,"A small CafÃ© with delicous food â€“ I never had sandwiches this delicious. Plus, the peeps behind the counter are fast, friendly and very kind. You are in Haight-Ashbury? Go grab a sandwich and a coffe at CafÃ© Cole.","['Cafe', 'Coffee Shop']",7133492,1395764802,3/25/2014,"[37.76925, -122.450761]",$$$,3/25/2014 16:26,16,26,42,0.640167608,positive,1
262,5,7127739,"Experienced this place at the CRAWLOWEEN 2013. This place rocks. Good drinks, friendly bartenders â€“ when I remember it correctly. Can only reco this place.",['Cocktail Bar'],4945970,1395768617,3/25/2014,"[37.795818, -122.421631]",$$,3/25/2014 17:30,17,30,17,0.371935176,positive,1
263,5,7127739,Tacos gone mad. Can only reco this place.,"['Mexican Restaurant', 'Fast Food Restaurant', 'Bar']",1339325,1395768428,3/25/2014,"[37.79732, -122.422174]",$$$,3/25/2014 17:27,17,27,8,-0.856020643,negative,-1
264,5,7127739,"A very nice bartender who happens to have a strong interest in art, especially Neo Rauch. You typical dive bar. If you want beer (Anchor Steam, Fat Tire, Blue Moon) for a reasonable price in an environment where nobody bugs, this is your place to be. Love places like this. No chi chi, just straight drinks. THUMBS UP!","['Cocktail Bar', 'Sports Bar']",7289134,1395768397,3/25/2014,"[37.769858, -122.448045]",$$$,3/25/2014 17:26,17,26,37,0.80372378,positive,1
265,5,7127739,"Coming from the self entitled ""land of beer"" (Germany), I can only say: Magnolia rocks â€“ never had better beer, never been to a better pub with craft beer. Germany can stop making beer now â€“ here's how you make fab and delicious beers today. The food? The food never disappoints â€“ organic chicken, deilicious burgers, you name it. This location is outstanding and I always think of the Magnolia when I think of SF.","['Southern Restaurant (US)', 'American Restaurant', 'Brewery']",5227634,1395764974,3/25/2014,"[37.770319, -122.445188]",$$,3/25/2014 16:29,16,29,34,0.749858739,positive,1
266,5,7127739,"THIS. WAS. THE. BEST. SUSHI. EVER. If you dig California style sushi, look no further. Worth every effing cent.","['Sushi Restaurant', 'Asian Restaurant', 'Japanese Restaurant']",3736863,1395768961,3/25/2014,"[37.77592, -122.426286]",$$,3/25/2014 17:36,17,36,1,0.950602006,positive,1
267,2,9542606,Over cheesy fattening and tasteless...not a winning combo.  Second time there and both times flavorless.  This is like gourmet airplane food...save your money if you're a foodie!,"['Pizza Restaurant', 'European Restaurant', 'Italian Restaurant']",2323218,1322520414,11/28/2011,"[34.04648, -118.433694]",$$,11/28/2011 22:46,22,46,54,-0.819450445,negative,-1
268,4,9542606,"Adds needed flavor and panache to this hood.  Interesting food and friendly service.  Wish there were a couple  lighter menu choices and music (pink martini radio?) for those of us over 32.  Young crowd & dialect ""like for sure totally awesome"" abounds.  Stil,  very welcome.",['Sandwich Shop'],9327226,1331535165,3/11/2012,"[34.056728, -118.442815]",$$,3/12/2012 6:52,6,52,45,0.519798753,positive,1
269,2,8186514,Horrible customer service.,"['Cell Phone Store', 'Electronics Store']",8111550,1359835931,2/2/2013,"[34.085646, -117.965017]",$$,2/2/2013 20:12,20,12,11,-0.942992787,negative,-1
270,5,7856545,Number one place in bskersfield.i been in modt bskersfield mexican restaurant.but molcajetes.arr the best.congratulations.u guys know what u doing....,"['Mexican Restaurant', 'Latin American Restaurant']",6468788,1359128348,1/25/2013,"[35.354214, -119.030667]",$$,1/25/2013 15:39,15,39,8,0.793182339,positive,1
271,3,7856545,I been there couple times but doesnt worth it .the service is ok.the food its ok. The only thing is wrong . They got the oldest waitress i ever see. Also they smell strong. U know they need to wear s better ferfume......,"['Mexican Restaurant', 'Latin American Restaurant']",531061,1359127955,1/25/2013,"[35.364603, -118.975431]",$$,1/25/2013 15:32,15,32,35,-0.282483571,neutral,0
272,2,7856545,Food is the nasty in town.owner its on assh.,"['Mexican Restaurant', 'Latin American Restaurant']",9097948,1359218877,1/26/2013,"[35.371649, -118.970482]",$$,1/26/2013 16:47,16,47,57,0.204911993,neutral,0
273,1,8901684,"An outstanding nutrition care - ordered a sandwich, pay for it and get nothing. Be in shape with Atlas Cafe!  P.S. Music was nice.",['Cafe'],9437140,1329464127,2/16/2012,"[37.759013, -122.411464]",$$$,2/17/2012 7:35,7,35,27,0.8941879,positive,1
274,5,3714958,Very busy as it is a popular stop. Friendly staff and wait time wasn't bad.,"['Restaurant', 'Fast Food Restaurant', 'Hamburger Restaurant']",4210564,1339105927,6/7/2012,"[37.975935, -122.065647]",$$$,6/7/2012 21:52,21,52,7,0.609681964,positive,1
275,5,1711548,"2:1 employee:customer ratio means good customer service! Also a totally swanky establishment.  There was an epic line outside, not sure what for. I had a genius bar appointment so no sweat getting in for that.","['Electronics Store', 'Computer Store']",2523341,1306458665,5/26/2011,"[37.800448, -122.43837]",$,5/27/2011 1:11,1,11,5,-0.361380364,negative,-1
276,4,9670474,"Ceviche w fresh, not frozen, sea bass. Well seasoned, what more to ask?",['Seafood Restaurant'],8183957,1316638117,9/21/2011,"[34.083357, -118.32846]",$$,9/21/2011 20:48,20,48,37,0.514576287,positive,1
277,5,1100564,"The best sports bar I've been too. I used to go here with my boyfriend for Laker games, and Oh my God it gets wild in there. Drinks are at a good price and the bartenders are very friendly.","['American Restaurant', 'Sports Bar']",3145528,1339016234,6/6/2012,"[34.151711, -118.452543]",$$,6/6/2012 20:57,20,57,14,0.959201109,positive,1
278,5,4513347,"I have been going to Palmie since it first opened in Palm Springs more than 15 years ago; in fact before it opened it was a place called Chez Zizi run by a French Canadian family.  That closed, and soon after Alain and Martine opened Palmie.  In Palm Springs it was a Parisian style bistro with posters of Aznavour and Bardot on the walls, but now in Palm Desert is it set up more like a French country inn which is actually more in keeping with its identity.  The location isn't perfect, being part of a retail center, but once you get inside it's easy to forget your surroundings and indulge in the wonderful food and the gracious treatment you receive from a truly family owned and operated business.  The food is excellent.  The menu is not extensive, but it's enough to satisfy any taste; they focus on doing less dishes really well rather than a wide range of things done fairly well.  I have turned dozens of friends and family members on to Palmie over the years, and all of them continue to go back.  It's simply a warm, friendly place with wonderful and authentic French food.  What's not to love?",['French Restaurant'],3829118,1289635426,11/13/2010,"[33.724, -116.3985]",$,11/13/2010 8:03,8,3,46,0.681000737,positive,1
279,3,2702385,The atmosphere was nice . It seemed the waiters had no set area so we were asked if eerily needed service from 4 different people. The tri tip was really tough and had lots if gristle. Nit sure I'm going back,"['Sports Bar', 'Bar & Grill', 'Pizza Restaurant']",1635527,1349063623,9/30/2012,"[36.330079, -119.290919]",$$,10/1/2012 3:53,3,53,43,-0.056117715,neutral,0
280,4,1315317,"They allow you to make payments on large items with no credit check. This is a wonderful idea for someone, such as myself, who has poor credit due to my divorce. I needed furniture quickly and I was able to get it through them. They are sales people and can be seen as pushy because their job is to sell... however they were very helpful every time I went in. I have a TV, couches, and washer/dryer through them. They will call you daily if you are a couple of days late on your payment but if you just let them know that you won't be able to make the payment for another few days they are totally ok with it. They do warn you though that they are still required to call daily until the payment is made. I just ignore those calls if it happens because we have already made the agreement and they know I'll be paying it another day. If you do ignore the calls and don't make an arangement with them, they will call your contacts on your application. That's understandable though... it's technically their product you are leasing and they want to ensure you haven't just run off with it. Make sure you call and make arrangements if you cannot make your payment on time.   The only downside to this program, of course, is that in the long run it is more expensive than just going and buying furniture. But... if your financial situation or credit is an obstacle I would definitely consider going to these guys. They're always friendly, helpful, and understanding.","['Furniture Rental Service', 'Furniture Store']",4705057,1277478855,6/25/2010,"[34.472566, -117.291796]",$$$,6/25/2010 15:14,15,14,15,0.149591971,neutral,0
281,4,6284659,"Love it here, great by the slice pie.","['Pizza Restaurant', 'European Restaurant', 'Italian Restaurant']",5079831,1371870256,6/21/2013,"[38.249339, -122.042147]",$$,6/22/2013 3:04,3,4,16,0.930898788,positive,1
282,5,6978619,Grubbed down at Grubby's!,"['Mexican Restaurant', 'Sports Bar', 'Breakfast Restaurant']",1416498,1344141985,8/4/2012,"[33.15871, -117.34995]",$$,8/5/2012 4:46,4,46,25,-0.666618632,negative,-1
283,5,6978619,"Great food, very convenient. Friendly staff and excellent naan. Muttar paneer was the best I've had yet.","['Indian Restaurant', 'Asian Restaurant', 'South Asian Restaurant']",9849561,1340770220,6/26/2012,"[37.796218, -122.404576]",$$,6/27/2012 4:10,4,10,20,0.923438339,positive,1
284,5,6978619,"Staff are friendly and fast. Amazing fresh roasted coffee, espresso to die for!","['Coffee Shop', 'Espresso Bar', 'Sandwich Shop']",6882457,1338396297,5/30/2012,"[34.05694, -117.181528]",$$$,5/30/2012 16:44,16,44,57,0.934626786,positive,1
285,5,6978619,Great service and amazing desserts. Ice cream is made in house as well as the baked goods. Try the chocolate krunch cake and the brown butter cookies!,['Bakery'],6692429,1373073626,7/5/2013,"[34.146171, -118.114883]",$$,7/6/2013 1:20,1,20,26,0.929419048,positive,1
286,5,6978619,"Short wait, definitely worth it! Had the vegan club on toasted buckwheat, with an arugula and spinach side salad. Very fresh and perfect amount of food. Can't wait to come back sometime!","['Sandwich Shop', 'Caterer']",2143569,1341606097,7/6/2012,"[34.052871, -118.250842]",$$,7/6/2012 20:21,20,21,37,0.920420162,positive,1
287,4,6978619,Love the BRC!,"['Mexican Restaurant', 'Latin American Restaurant']",3375790,1338396558,5/30/2012,"[34.056546, -117.176224]",$$,5/30/2012 16:49,16,49,18,0.895935204,positive,1
288,5,5581979,"We totally enjoyed our experience here... the owner, cook and waiter went out of their way to provide us with every dish and desire of our hearts! Looking forward to going back very soon!!! :-)","['Italian Restaurant', 'European Restaurant']",7705024,1355700518,12/16/2012,"[37.57697, -122.349228]",$$,12/16/2012 23:28,23,28,38,0.88954261,positive,1
289,5,8729898,"For a higher profile dining experience, this is definitely a must-experience place! Been here twice for special occasions and twice we had a great evening.","['American Restaurant', 'Steak House']",8077658,1364741822,3/31/2013,"[37.793443, -122.422737]",$,3/31/2013 14:57,14,57,2,0.945095886,positive,1
290,5,4097661,The wrap sandwiches are really great.  I'm not a veggie guy .. but this place is worthwhile (sit outside),"['Vegan Restaurant', 'Vegetarian Restaurant']",4499066,1289923719,11/16/2010,"[33.650328, -117.837789]",$$$,11/16/2010 16:08,16,8,39,0.660844847,positive,1
291,2,8707160,"Took my out of town buddies to the Comedy & Magic Club last night. What we experienced was funnier than the comics (yes, even Jay). We all know about the two drink minimum, but now thereâ€™s a three drink maximum. Are you kidding me!? Why? Half way through the show, we were left high and dry. Secondly, knowing that their food isnâ€™t great, we decided to play it safe with a couple of appetizers. â€œWeâ€™re out of shrimp and bread sticksâ€. What!? How do you run out of bread sticks!? Lastly, with the host making his closing â€œthanks for comingâ€ remarks, we tried to leave. The overly arrogant security guard wouldnâ€™t let us out until he was done. Come on! Seriously!? Weâ€™re done with this club!","['Comedy Club', 'Live Music Venue']",6853141,1381164077,10/7/2013,"[33.860869, -118.399484]",$$,10/7/2013 16:41,16,41,17,-0.614545147,negative,-1
292,4,747627,"Came here with my roommate, not to bad. Ladies are very friendly, they gave our dog water and talked to him. Plus big portions. Wuld definitely come back","['Asian Restaurant', 'Chinese Restaurant']",9302961,1374721787,7/24/2013,"[38.570449, -121.498385]",$$$,7/25/2013 3:09,3,9,47,0.626843815,positive,1
293,2,5864497,Great service and atmosphere but food is mediocre,['Mexican Restaurant'],8576119,1394674529,3/12/2014,"[37.750882, -122.4182]",$$$,3/13/2014 1:35,1,35,29,0.075408139,neutral,0
294,3,657403,Wait for ever in the drivethoug and very slow as hell inside to,"['Fast Food Restaurant', 'Takeout Restaurant', 'Hamburger Restaurant']",4659804,1375329367,7/31/2013,"[33.818539, -117.909195]",$$$,8/1/2013 3:56,3,56,7,-0.608359235,negative,-1
295,5,932403,Loved it,['European Restaurant'],2659851,1390756296,1/26/2014,"[33.87773, -117.962876]",$$$,1/26/2014 17:11,17,11,36,0.762619368,positive,1
296,3,9426983,$5.99 for lg,['Delivery Restaurant'],3301030,1341775571,7/8/2012,"[38.105789, -122.221244]",$$$,7/8/2012 19:26,19,26,11,-0.145424654,neutral,0
297,5,2761323,I was in San Diego recently on business and I visited the Butcher Shop on a few occasions and found the staff very friendly and the food was fantastic.. I would recommend it highly,['Steak House'],202956,1370606672,6/7/2013,"[32.829979, -117.140867]",$$,6/7/2013 12:04,12,4,32,0.775364183,positive,1
298,5,484090,"Yummy ravs and I love their angel hair pasta, too. They also have great sandwiches. They are a Willow Glen staple! And big fans of the Sharks!","['Italian Restaurant', 'Sandwich Shop', 'Deli']",8356657,1327639708,1/26/2012,"[37.304656, -121.898423]",$$,1/27/2012 4:48,4,48,28,0.944167451,positive,1
299,5,484090,"I love hanging out here on occasion. Great bar for a quick dinner with a friends. Great restaurant for my book club or other larger groups. I am a huge fan of their pear salad and I order it almost every time - but the other night I had their strawberry spinach salad and it was delish! A glass of the La Crema chardonnay at $11bucks is a bit steep, but their house chardonnay is $6.00 Salmon Creek and pretty good, too!  Fun WG restaurant. I wish there were more places like TT in Willow Glen.","['Bar', 'European Restaurant', 'Italian Restaurant']",9967569,1314826349,8/31/2011,"[37.293671, -121.912183]",$$,8/31/2011 21:32,21,32,29,0.601227879,positive,1
300,5,484090,"we had a large bachelorette party dinner there last night and it was great. Our server somehow very graciously handled our party of drunk or buzzed women and they even accomodated our Dinner on one bill and then cash and carry for the cocktails. I wish i would have gotten our servers name - she was a super sweet very attractive woman - maybe Asian - not that it matters but I really want to give her a SHOUT OUT and I don't know her name. She was VERY VERY good and just handled our craziness with aplomb.   As far as food, I did not hear one complaint. I ordered the fried chicken salad which was this HUGE portion of dressed greens and three big pieces of deep friend breast meat and it was AWESOME. We also shared the alligator strips and the fried green tomatoes and they were all delish, too.   Thanks Roux for a great evening and a fab bachelorette party.",['Restaurant'],4197113,1318137918,10/8/2011,"[37.320526, -121.949058]",$$,10/9/2011 5:25,5,25,18,0.69344327,positive,1
301,5,484090,Such a fabulous atmosphere and the good is yummy. Great staff and very inspired menu. Super fun place to go with a girlfriend for a fun dinner or with a large group for a birthday.,"['Cajun Restaurant', 'American Restaurant', 'Southern Restaurant (US)']",7058207,1337017301,5/14/2012,"[37.445012, -122.161398]",$$,5/14/2012 17:41,17,41,41,0.928344347,positive,1
302,5,484090,"Love their happy hour. Love Viva a Go Go, too. Amazing wine list and great service. Love Amy, the bartender, too. Viva is lucky to have her working for them.  Super fun place to celebrate a special occasion.",['Restaurant'],5040888,1352876195,11/13/2012,"[37.236066, -121.961724]",$$,11/14/2012 6:56,6,56,35,0.92735573,positive,1
303,5,484090,"Love their super creative offerings on their sushi boats. Love the location, too. The staff is very friendly and all of their fish tastes super fresh.","['Sushi Restaurant', 'Asian Restaurant', 'Japanese Restaurant']",9914070,1314163604,8/23/2011,"[37.294879, -121.964204]",$$,8/24/2011 5:26,5,26,44,0.901841434,positive,1
304,4,484090,"best mole ever  Love the decor. Parking can sometimes suck at lunch time, but the food and their margaritas rock.","['Restaurant', 'Latin American Restaurant', 'Mexican Restaurant']",1359519,1342163668,7/13/2012,"[37.39527, -122.099744]",$$,7/13/2012 7:14,7,14,28,0.908661597,positive,1
305,5,484090,"Love this place. My book club had another fabulous dinner at this place tonight. We had a group of 8 with an amazing server who put up with all of our crap. The food is always so so so good and great menu and great wine list, too.   We always get great service even when we are sometimes a bit difficult to put up with. Such a special occasion place and a great place for a special date, too. the happy hour form 4 to 6 is AMAZING","['Eclectic Restaurant', 'Wine Store', 'Lounge']",5417302,1324533118,12/21/2011,"[37.228226, -121.980683]",$$,12/22/2011 5:51,5,51,58,0.963730277,positive,1
306,5,484090,"Love their omelettes and their salads. Plus, their service is fan-freaking-tastic. I also love hosting a meeting there twice a month... for the awesome service, the yummy food and the location is super convenient. I am a big fan of the Campbell and Los Gatos Hobees. Have not really frequented their other locations much.   They now have a gluten free menu, too.","['American Restaurant', 'Sandwich Shop']",4645085,1314163519,8/23/2011,"[37.228016, -121.97995]",$$,8/24/2011 5:25,5,25,19,0.775027665,positive,1
307,5,417419,They make my favorite cappuccino.  Love it with a chocolate croissant.  This place is a must anytime I am back in town,"['Coffee Shop', 'Tea House']",4234172,1389853131,1/15/2014,"[34.150561, -118.11302]",$$$,1/16/2014 6:18,6,18,51,0.955792159,positive,1
308,4,480544,I love picking up a dozen or so to bring home or to take to potlocks...however we've not had good experiences when we've done large catering orders from them.,"['Mexican Restaurant', 'Latin American Restaurant', 'Vegetarian Restaurant']",2448064,1392922686,2/20/2014,"[36.806836, -119.859942]",$$,2/20/2014 18:58,18,58,6,0.219015658,neutral,0
309,3,480544,"I'm a regular here, so it's bittersweet to rate this place. Sales and items are great - organization and cleanliness leave a little to be desired, but those are things you can get over - however the staff (about 80%) is worthless!  Staff aren't helpful, knowledgeable, efficient, etc. and the store usually has cashires understaffed in the firsy place, so when checking-out during a high traffic time you could spend more than a half an hour in line before uou reach a register.","['Craft Store', 'Fabric Store']",7677228,1385840247,11/30/2013,"[36.853035, -119.78949]",$$,11/30/2013 19:37,19,37,27,-0.34599264,negative,-1
310,4,1131240,"I went to check out my gf cousins band and had a pretty awesome time here. A bit small but still had fun. The drinks were good and cheap. Best margarita I've ever had, no lie.",['Live Music Venue'],4229653,1304795324,5/7/2011,"[34.054833, -118.383275]",$$,5/7/2011 19:08,19,8,44,0.783210703,positive,1
311,5,1131240,Best Burgers in the area... better than In N Out and that's a big claim!,"['Hamburger Restaurant', 'Fast Food Restaurant']",1368531,1305051515,5/10/2011,"[33.858562, -118.089494]",$$$,5/10/2011 18:18,18,18,35,0.947456291,positive,1
312,3,1131240,"The smoothie was not all day tonight, disappointed in the service. Hopefully it improves.","['American Restaurant', 'Cafe', 'Vegetarian Restaurant']",6017603,1299396321,3/5/2011,"[34.04505, -118.251944]",$$$,3/6/2011 7:25,7,25,21,-0.31739558,negative,-1
313,5,5188156,Great food and nice atmosphere!,"['Pizza Restaurant', 'European Restaurant', 'Italian Restaurant']",13192,1373979664,7/16/2013,"[33.503423, -117.146278]",$$,7/16/2013 13:01,13,1,4,0.849083727,positive,1
314,4,4431385,"My husband and I recently went in there and tried it for the first time.  My husband had a cheeseburger and I had a grilled cheese.  He asked for two orders of fries and without asking him what size he wanted they rang him up for two large fries, (which were about 5 bucks a piece) they have small, medium, and large fries, fyi!",['Sandwich Shop'],1780528,1364449142,3/27/2013,"[38.742477, -121.226487]",$$$,3/28/2013 5:39,5,39,2,0.270573961,neutral,0
315,5,9740069,Best mountain mikes in town! clean too!!!,"['Pizza Restaurant', 'European Restaurant']",5902282,1360901257,2/14/2013,"[38.039177, -121.259464]",$$,2/15/2013 4:07,4,7,37,0.961102341,positive,1
316,4,9740069,Lover it!! not tradtional Mexican food better lIght not heavy and greasy,"['Mexican Restaurant', 'Latin American Restaurant']",4983941,1349217340,10/2/2012,"[38.567987, -121.489408]",$$,10/2/2012 22:35,22,35,40,-0.385308359,negative,-1
317,5,9108068,Awesome coffee and awesome food! Outdoor sitting area is nice.,"['Coffee Shop', 'European Restaurant']",3366938,1343164323,7/24/2012,"[37.798998, -122.408524]",$$$,7/24/2012 21:12,21,12,3,0.903547761,positive,1
318,2,6978428,Very bed service for only 5 tables in the entire restaurant,['Buffet Restaurant'],8269168,1371868520,6/21/2013,"[32.801344, -116.963802]",$$,6/22/2013 2:35,2,35,20,-0.200426523,neutral,0
319,5,6683792,"My experience in the Verizon Store on Rengstorff in Mt. View yesterday was outstanding.  You know, we all expect to walk in and get immediate service and then get help for as long as it takes to solve our issue... well, these guys did a good job of making me feel connected and served, even while I waited.  It's a real balance for 5 staff members to make 12 people feel like they're all being taken care of at once!  Chris, the manager got involved to assist the sales rep with some of my more intense issues.  I'd recommend this store if you need professional service and attention to detail.","['Cell Phone Store', 'Telephone Company']",1972290,1386379165,12/6/2013,"[37.419996, -122.096169]",$$,12/7/2013 1:19,1,19,25,0.589049291,positive,1
320,5,1760823,Great and clean store. Great deals,['Grocery Store'],9080336,1373523530,7/10/2013,"[32.627499, -117.075]",$$,7/11/2013 6:18,6,18,50,0.892591125,positive,1
321,5,4163123,The best place in Fairfield/Vacaville by far. The food is fabulous and the owner makes sure that you are treated like a  king/queen. We love to take our friends and family so that they can  also experience his excellent service and entertaining personality. A Must for sure!!!!,['Mediterranean Restaurant'],9616855,1373664955,7/12/2013,"[38.213574, -122.144577]",$$,7/12/2013 21:35,21,35,55,0.94140754,positive,1
322,4,4554721,"We. Were. Hungry,  food delicious",['Steak House'],221052,1380225412,9/26/2013,"[36.573009, -119.627052]",$$,9/26/2013 19:56,19,56,52,0.598654015,positive,1
323,5,3165108,"Awesome place! And absolutely love their "" Mexi-cobb Salad"" Delicious! Haven't been able stay away!","['American Restaurant', 'Latin American Restaurant', 'Sports Bar']",5387755,1358177416,1/14/2013,"[36.009386, -115.117085]",$$,1/14/2013 15:30,15,30,16,0.969594999,positive,1
