Unnamed: 0,rating,user_id,reviewText,categories,item_id,unixReviewTime,reviewTime,gps,price,dtime,hour,minute,second,sentiment score,sentiment_label,sentiment_numeric
583,1,3760666,"not only did they get the order wrong, they forgot a main reason why we even came in. the carne asada burrito. when i called them to tell them, they were first they were rude on the phone, we went in they were ruder in person, they didn't apoligize or, they woman who took the order was so rude.  the food was cold. will not go back. ever and will tell all others to only eat in where you can see what you get before you drive back to your house.","['Latin American Restaurant', 'Mexican Restaurant']",2644160,1307929483,6/12/2011,"[32.82296, -117.184386]",$$$,6/13/2011 1:44,1,44,43,-0.601637294,negative,-1
584,2,3760666,"hate it!!! first when in a steak house don't order vegetarian. especially this steak house! everything had bacon in it and the dish i got looked like oatmeal and tasted worse. 15 dollars for risotto with NO VEGETABLES in it and a weird boring butternut squash sauce. when i asked the waiter about it, who never once came by our table to check on us~ it was clear he had no interested in my feelings about my food. three things that were on their menu weren't available. really the service for what it's suppose to be was way under par. the manager made his way over to us with a disinterested look and didn't even make eye contact. we had gone for a birthday looking for what we thought was on the menu and it wasn't, as well no even wished the birthday goer happy birthday!!! totally sucked!!!  i will not be returning and sincerely can't imagine how much longer the cowboy star will be in my fair city.","['American Restaurant', 'Butcher Shop', 'Fine Dining Restaurant']",5951385,1393134590,2/22/2014,"[32.712144, -117.155866]",$,2/23/2014 5:49,5,49,50,-0.959011975,negative,-1
585,5,3760666,"yummy! we just eat two 18 inch nyc pies! as pizzeria owners i gotta say this is one seriously rockin pie! it is worth driving from anywhere in san diego to get the real deal. if your from the east coast and your missing your food, then come to this joint and eat it up! so good! we ate both pies! amazing! thank you pizza guys  @ fat tony's !","['Pizza Restaurant', 'European Restaurant', 'Italian Restaurant']",6729197,1279426711,7/17/2010,"[32.835746, -117.186966]",$$,7/18/2010 4:18,4,18,31,0.927511172,positive,1
586,5,395858,Great food!,"['Mexican Restaurant', 'Latin American Restaurant']",646048,1394054152,3/5/2014,"[33.760161, -117.876757]",$$,3/5/2014 21:15,21,15,52,0.876885047,positive,1
587,5,7434694,Excellent if you're looking for a fancy dinner at a fair price.,"['Mediterranean Restaurant', 'European Restaurant', 'American Restaurant']",5554562,1391014039,1/29/2014,"[34.006708, -118.49184]",$,1/29/2014 16:47,16,47,19,0.747216054,positive,1
588,5,7434694,Never had better. Wild boar and lamb were amazing,"['American Restaurant', 'New American Restaurant']",2267587,1393006117,2/21/2014,"[37.793245, -122.392862]",$,2/21/2014 18:08,18,8,37,0.704243028,positive,1
589,2,7434694,Mediocre place with awful margaritas.,['Seafood Restaurant'],4553768,1391013936,1/29/2014,"[34.009665, -118.49719]",$$,1/29/2014 16:45,16,45,36,-0.668447844,negative,-1
590,5,2749647,"Spring for the souvenir mug. Totally worth it. Awesome atmosphere, great drinks, great service.","['Cocktail Bar', 'Lounge']",8479134,1346992990,9/6/2012,"[36.159059, -115.164699]",$$,9/7/2012 4:43,4,43,10,0.928096624,positive,1
591,3,5909318,"If you have used $10 coupons on your purchase and return the item, don't expect to get that $10 back if you return the item.  I returned a quesidella maker as it did not heat properly.  I had two ten dollar coupons and I only got one back.  I earned the coupons and I have had this happen before.","['Department Store', 'Variety Store']",8825646,1370276260,6/3/2013,"[39.419116, -119.755522]",$$$,6/3/2013 16:17,16,17,40,-0.788521408,negative,-1
592,2,5282875,"ok...I like the take-out but always a little cautious, not sure why. Got a delish Chile Relaino with beans & salad. There was a LONG BLACK HAIR IN MY SALAD! Cant stop thinking out PULLING it out of my mouth, SICK    Thats it   disturbed!!","['Latin American Restaurant', 'Mexican Restaurant']",4592445,1383434507,11/2/2013,"[33.50586, -117.66494]",$$$,11/2/2013 23:21,23,21,47,-0.009289943,neutral,0
593,5,7576793,Great NewYork steak incredible view.,"['Restaurant', 'Steak House', 'American Restaurant']",7273470,1338420596,5/30/2012,"[33.983599, -118.44768]",$$,5/30/2012 23:29,23,29,56,0.883400993,positive,1
594,2,2041254,"I went in loaded for bear. I have had problems with Sprint dropping calls. Stopped in to have them check my phone all was  well. Went home called Sprint. They SAID that the problem was with the network and that the 2 towers that serviced mare that one was at 65% of power and the other was 45% of power. They stated that they would check into it and get back to me in no less than  3 days day 4 arrived i waited until late in the day and called them. gave them the run down and low and behold they wanted to do all the tests again . 1st my phone . which I told them I had checked out at the sprint store But it means nothing. Then they looked at my records and said for the 2nd time "" yes you do have a lot of dropped calls"" Then they started talking about service areas. I stated that I was in the service area per their map.. Oh she said. you have to go online and look.. what you maps are not correct? I saw nothing to say I needed to go online?  after a few more minutes of them trying to blame my area and my house and my location  I stated that they were out of contract as my service was minimum at best. they then moved me up the ladder. mmmm bout 5 minutes later another person on the phone ask me the same crap i had explained 3 times before.. i was going to blow chunks about now. Then she says oh I see you have a lot of dropped calls.. phunking wise woman. She then said that they would be happy to let me out of my contract as I was now on the EDGE of the service area and they could not give me the service that i was paying for..All I had to do was return the phone? What I said I bought they phone! I paid up front for the phone and the service and the phone belonged to me. Well long story short. Sprint SUCKS. They play little games  when in fact they need to be honest sooner.","['Cell Phone Store', 'Telecommunications Contractor', 'Electronics Store']",8042087,1350256939,10/14/2012,"[38.422408, -121.402744]",$$,10/14/2012 23:22,23,22,19,-0.624104667,negative,-1
595,5,3810174,Looking forward to going In a few minutes. Love the food and view of Lake Gregory.,"['Mexican Restaurant', 'Latin American Restaurant']",1101245,1367797635,5/5/2013,"[34.243597, -117.275413]",$$,5/5/2013 23:47,23,47,15,0.663444335,positive,1
596,4,1642277,I love their clothes!!!  They could make some improvements though...,"['Clothing Store', ""Men's Clothing Store"", ""Women's Clothing Store""]",9938202,1377962453,8/31/2013,"[37.325907, -121.812801]",$$,8/31/2013 15:20,15,20,53,0.547153185,positive,1
597,5,1642277,Yummy!!!  The maui zaui is to DIE FOR!!!!!!!!,"['European Restaurant', 'Pizza Restaurant']",1351806,1377962587,8/31/2013,"[37.32276, -121.98]",$$,8/31/2013 15:23,15,23,7,0.492359336,positive,1
598,5,2950526,"this record store is what i picture heaven looking like.huge selection, fantastic place for both essential albums and rare finds at fair prices. very knowledgeable and friendly staff. a must for any music lover. only drawback is no public restroom, so just like those family roadtrips, make sure you take care of it before you leave home, because it'll be awhile before you get the chance again.","['Music Store', 'Video Store']",4822128,1346025600,8/26/2012,"[34.097844, -118.329027]",$$$,8/27/2012 0:00,0,0,0,0.801835417,positive,1
599,4,5097918,"I like the place and food, but service isnt so good.","['Sushi Restaurant', 'Asian Restaurant', 'Japanese Restaurant']",8312716,1365826153,4/12/2013,"[38.579567, -121.415638]",$$,4/13/2013 4:09,4,9,13,0.096133093,neutral,0
600,5,5097918,This place has got to be the BEST! i love thai food and this place never disappoints me! Great food and worth the price,"['Thai Restaurant', 'Asian Restaurant', 'Southeast Asian Restaurant']",1200507,1365825951,4/12/2013,"[38.528562, -121.472816]",$$,4/13/2013 4:05,4,5,51,0.950221373,positive,1
601,5,5097918,Love the sushi and love the service!!!,"['Japanese Restaurant', 'Asian Restaurant', 'Sushi Restaurant']",6582620,1365826036,4/12/2013,"[38.594692, -121.414247]",$$,4/13/2013 4:07,4,7,16,0.897809633,positive,1
602,5,3986411,"Cristina was great, she helped me unlock my phone. I didnt loose my contacts and my pictures were saved. Thank you!","['Cell Phone Store', 'Electronics Repair Shop']",8767501,1362008357,2/27/2013,"[37.677485, -121.785957]",$$$,2/27/2013 23:39,23,39,17,0.913463216,positive,1
603,3,3708601,"This was the worst applebees I have been to in my entire life. I have been to many restaurants in my military service. But this one has taken the cake in having the worst customer service. The waitress did not only tell us she did not know the prices and to look it up our selves  with such an attitude like it was my responsibility to know the prices of their food. Plus everytime we asked her for something she made it seem like it was an unconvince to get it for us. Then we asked for desert and then she said they did have it and then the table next to us got that desert like two min later. But that was not what took the cake. It was the fact that it was veterens day and they didn't give myself and my mother after 20 plus years of service are free meal which was ok seeing how they did it the day prior but in there advertisement it was for today. But we had to literly fight for are 10% off for military discount. Then the waitress said it was only a couple of dollars and she would have to take are credit cards back and do it all over again with the worst attitude ever. So in conclusion if you are a military vet or someone who just likes good customer service with no attitude or you want a meal without feeling like your bothering them then don't ever go to this applebees. I will be passing this info on to every marine ,air force.navy coast guard..army , or any person that likes good service","['American Restaurant', 'Bar & Grill', 'Steak House']",3375033,1352784334,11/12/2012,"[38.426798, -121.395935]",$$,11/13/2012 5:25,5,25,34,-0.905534333,negative,-1
604,1,6235257,"The food here is way more expensive than other taco shops and the burritos are small with inferior meat, if you get enough on your burrito to taste it. The tortilla was not cooked ask the way through and was just to soggy. Avoid this place.","['Latin American Restaurant', 'Mexican Restaurant']",3617214,1342384765,7/15/2012,"[33.485079, -117.078728]",$$$,7/15/2012 20:39,20,39,25,-0.731575764,negative,-1
605,5,6235257,"Amazing food, prices are ok","['Latin American Restaurant', 'Mexican Restaurant']",8502541,1342385124,7/15/2012,"[33.237426, -117.29684]",$$$,7/15/2012 20:45,20,45,24,0.722217067,positive,1
606,3,6235257,Only go here if you don't mind having to ask them to remake your drink several times. It is a miracle if they get it right on the first go.,['Coffee Shop'],7098055,1355080750,12/9/2012,"[33.226604, -117.331427]",$$$,12/9/2012 19:19,19,19,10,-0.249456714,neutral,0
607,5,8516060,Holy Horchatas...these baristas have this Horchata Latte...wooooooow...and tres leche muffins are sooo delish I get two of everything. My new daily breakfast and coffee stop. If the lines too long its worth it. But it usually goes quick. Thanks Terra mia u guys got me hooked,"['Caribbean Restaurant', 'Latin American Restaurant', 'Coffee Shop']",5594435,1366136844,4/16/2013,"[33.96947, -118.100534]",$$,4/16/2013 18:27,18,27,24,0.620592396,positive,1
608,5,2508705,Loved Pliney the Elder!  GABF,"['Brewpub', 'Brewery']",5242532,1350009781,10/11/2012,"[38.441704, -122.711536]",$$,10/12/2012 2:43,2,43,1,0.740816785,positive,1
609,5,2508705,Enjoyed the Santa s pet monkey at GABF,['Brewpub'],6427572,1350005431,10/11/2012,"[32.713825, -117.14934]",$$$,10/12/2012 1:30,1,30,31,0.491956792,positive,1
610,5,2508705,Their beers are absolutely amazing! Loved sampling them at GABF!,"['Stores and Shopping', 'Brewery']",7039122,1350179099,10/13/2012,"[33.140764, -117.149654]",$$,10/14/2012 1:44,1,44,59,0.966322781,positive,1
611,4,2508705,Definitely try the Red Trolley Ale! Enjoyed all the beers at GABF!,"['American Restaurant', 'Brewpub', 'Brewery']",6996850,1350179237,10/13/2012,"[32.717479, -117.167243]",$$,10/14/2012 1:47,1,47,17,0.782612293,positive,1
612,5,2508705,Excellent beers at GABF! love the red trolly ale,"['Brewpub', 'American Restaurant']",7204046,1350009161,10/11/2012,"[32.896549, -117.201962]",$$,10/12/2012 2:32,2,32,41,0.945237113,positive,1
613,5,4846722,"This is literally the best eatery ever! I love it. The wait staff are always friendly and will seat you as soon as possible. There's a real warm vibe in the place, especially at night when all the club patrons come to get some food, everyone starts feeling like family. For $20 you can feed an entire African village here!","['American Restaurant', 'Diner']",3985226,1381456418,10/10/2013,"[34.046317, -118.26287]",$$,10/11/2013 1:53,1,53,38,0.984567713,positive,1
614,4,4846722,This shit needs to be 24 hours. Do you know how many people looking for drunk midnight snacks would come just for a chance to see WeeMan?!,"['Mexican Restaurant', 'Latin American Restaurant']",8037966,1385201318,11/23/2013,"[33.837992, -118.384976]",$$$,11/23/2013 10:08,10,8,38,-0.876809283,negative,-1
615,3,4846722,"It's close to where I live and the pizza is good, I like it. It can take a while to get a whole pizza and the guys who work here aren't always polite, but they do always have good music playing.",['Pizza Restaurant'],1207383,1381456192,10/10/2013,"[34.047369, -118.2258]",$$$,10/11/2013 1:49,1,49,52,0.528940003,positive,1
616,5,6432164,Eduardo Sanchez was incredible.  He helped me with both of my phones and is a value employee.  I will definitely recommend my family and friends to this location.,"['Cell Phone Store', 'Electronics Store']",7541547,1376424284,8/13/2013,"[34.284948, -118.717284]",$$,8/13/2013 20:04,20,4,44,0.946759961,positive,1
617,5,9090259,Great customer service from top to bottom. Will never go back to Howe Ave store.,"['Cell Phone Store', 'Electronics Store']",7352987,1369009977,5/19/2013,"[38.609848, -121.384445]",$$,5/20/2013 0:32,0,32,57,0.911800988,positive,1
618,5,9090259,Great Burritos,['Restaurants'],6106726,1345234438,8/17/2012,"[38.571208, -121.465738]",$$,8/17/2012 20:13,20,13,58,0.845580205,positive,1
619,4,9090259,Great happy hour.  $1 oysters and great fish tacos,['American Restaurant'],98560,1370986307,6/11/2013,"[38.580156, -121.494678]",$$,6/11/2013 21:31,21,31,47,0.879552462,positive,1
620,4,9416952,"Must be one of the best bars for watching sports. Didn't eat there but the atmosphere for the NHL game was just great.  Super friendly bar staff, the place radiating with welcoming atmosphere.","['Sandwich Shop', 'Fast Food Restaurant']",8551301,1372054046,6/23/2013,"[37.798134, -122.407201]",$$$,6/24/2013 6:07,6,7,26,0.905826696,positive,1
621,2,5284078,"This place was disgusting, borderline inedible. I have been twice now, and it is by far- the WORST restaurant food I have ever eaten. I'm not kidding, a dollar cheeseburger at McDonalds is better than this crap. The food is stale, cold, gross, and thrown together. I had some kind of fish stew... I almost threw up. It was basically a couple chunks of fish and a crab claw thrown into a big slew of fishy broth. The veggies were rubbery and old, the cheese and bread were hard. I cannot believe that they can get away with charging 40 bucks a plate. But hey, it's Disney. They can do whatever they want!","['Restaurant or Cafe', 'Seafood']",3484339,1340389607,6/22/2012,"[33.805308, -117.920929]",$$$,6/22/2012 18:26,18,26,47,-0.948784041,negative,-1
622,5,1731022,"I have been to several Post Net locations in the area, but this location is by far the best.  Ron & Irene are always quick to help me with my small business needs","['Notary Public', 'Print Shop']",1548505,1341983202,7/10/2012,"[36.001117, -115.105286]",$$,7/11/2012 5:06,5,6,42,0.802975857,positive,1
623,1,4557536,Food is decent but service is terrible the waitress seems to hate people and it shows tip I think not the manager and the owner father and daughter we tried to tell them we didn't receive some things and they still charged for them so we brought it to their attention and told them we don't want a discount or asking for anything just to be treated right and the owner proceeds to tell us you have the right to go somewhere else next time,"['Mexican Restaurant', 'Latin American Restaurant']",7884915,1395369304,3/20/2014,"[32.812539, -117.268572]",$$,3/21/2014 2:35,2,35,4,-0.514606193,negative,-1
624,5,8155224,"Super good food and comfortable prices, nice environment and defiantly the best Thai food in the IE. Free Thai Tea Refills can't be beat!","['Restaurant', 'Asian Restaurant', 'Southeast Asian Restaurant']",2072725,1328676905,2/7/2012,"[34.107155, -117.608915]",$$,2/8/2012 4:55,4,55,5,0.891252239,positive,1
625,4,3720349,"Family owned,real nice people, they give u alot more, for the money u spend. Ive been going there for the last 13yrs. As long as its still open, ill sit at my little table by the window","['Chinese Restaurant', 'Asian Restaurant']",3000777,1358391315,1/16/2013,"[38.529664, -121.444897]",$$,1/17/2013 2:55,2,55,15,0.516307573,positive,1
626,3,2589417,maybe the manager was making a batch of tarter sauce,"['Restaurant', 'Seafood Restaurant', 'Fast Food Restaurant']",9547501,1348968870,9/29/2012,"[39.513955, -119.78905]",$$$,9/30/2012 1:34,1,34,30,-0.347061341,negative,-1
627,3,2589417,"Some Dennys are franchised and the owners do what the want more or less. If your going to compete then lower your prices and be competitive! My father had a shoe store in Ogden,Utah He always said ""its better to have 50 cents in the till than nothing!"" ""Treat your customers with respect be polite and thank them""! WORD OF MOUTH WORKS WONDERS IN THIS LOUSY ECONOMY!!!. Advertising costs money word of mouth is free and you get better results! Regular customers give them a freebie once in a while ! that shows them they are appreciated! Some cafes have blinders on and don't realize or care about customers  sometimes! I worked part time for Denny's in Salt Lake City I averaged a good per hr wage in tips alone! Besdes that we drew a good group of gays because we were really handsome and hot LOL","['Restaurant', 'American Restaurant']",7299807,1320797263,11/8/2011,"[37.784167, -122.404866]",$$$,11/9/2011 0:07,0,7,43,-0.159148149,neutral,0
628,2,2589417,"SUNDAY  BRUNCH ENCOUNTER! Hate to be negative but my first impression I was not impressed! First after entering the main door through a blanket covering entryway. There was a younger gal, at the door With, no greeting almost smug and arrogant, ""do you have a reservation""? I said ""NO""! her reply was "" there's a 45 min wait""! THE PLACE WAS 1/2 EMPTY! ""you can wait at bar"" !  I waited by the door several people entered same scenario  for them too ...finally one couple said can we eat at the bar? she said ""yes"" I said ""can I do the same""? she said ""uh huh""! I go sit at bar , the bar tender says"" I need to have your credit card"" I went to get the food that is supposed to outstanding? I will admit for a poorly stocked breakfast bar  it was meager. Yes the Chicken is good the biscuits seemed frozen pre made the white gravy reeked of garlic powder!  KFC is just as good or even better at 75% less money! The grits were lumpy too! NOT WORTH $ 20 A PERSON with oj and coffee and tip $30 pp  If you want the epitome of snobbery, and false fake pretense then eat here !  The food court at Nordstroms is a better choice",['Soul Food Restaurant'],4452653,1327796290,1/28/2012,"[37.783547, -122.409244]",$$,1/29/2012 0:18,0,18,10,-0.535585381,negative,-1
629,3,2589417,MOVED?????,"['Restaurant', 'Chicken Restaurant']",7620853,1323810874,12/13/2011,"[37.781922, -122.410104]",$$$,12/13/2011 21:14,21,14,34,-0.654553249,negative,-1
630,5,2589417,Wow what a great mall!! The food court too I am totally impressed  The locals are so lucky to have this place,['Clothing Store'],8024660,1327796011,1/28/2012,"[37.784143, -122.407361]",$$,1/29/2012 0:13,0,13,31,0.969692634,positive,1
631,3,2589417,avoid the gyro and do the hot lunch special  the greek potato salad is good too I suggest you get lemon in your water as the gyro made me have indigestion the day before,['Mediterranean Restaurant'],752503,1327106055,1/20/2012,"[37.77867, -122.415681]",$$$,1/21/2012 0:34,0,34,15,-0.16991392,neutral,0
632,5,2589417,I used to drive to the west coast almost every year usually would stop in Reno  then drive west By the time I arrived to Roseville I would take the freeway exit and stop for lunch on the way. This place had a different menu than the chain. Needless to say on my first visit there I had a marinated T bone steak. It was so tender I only needed a fork (no knife) The steak was cooked perfect and excellent!! It has been years since I went there so if anyone else goes there recent. Please post a review and  let me know if they still offer the t bone steak? My recent visit to a local Sizzler in Layton Utah was a very bad experience and I was very dissapointed as I have been going to Sizzler almost 40 years.,"['American Restaurant', 'Steak House']",8646227,1205771891,3/17/2008,"[38.743477, -121.257074]",$$,3/17/2008 16:38,16,38,11,-0.391392373,negative,-1
633,2,2589417,I went here with hopes of good food I was sick 1/2 hour later the food was not at proper temps  avoid this place is was not the cleanest place either!,"['Chinese Restaurant', 'Asian Restaurant', 'Japanese Restaurant']",3656300,1323811179,12/13/2011,"[37.780988, -122.411587]",$$$,12/13/2011 21:19,21,19,39,-0.82143778,negative,-1
634,1,3926011,"smells bad as soon as you enter the door, their shopping cart is full of trash, sticky handle, and some of the wheels are so annoyingly noisy. staffs don't care to ask if you need anything. their stock room staff (who keeps their inventory at par) are discourteous, either blocking your path or just simply pass by side-to-side and wouldn't courteously ask for an excuse.. hit my cart but never said anything, just looked at me like nothing happened. this is the worst Target i've ever visited.",['Department Store'],6645965,1376887209,8/18/2013,"[34.0696, -117.976824]",$$,8/19/2013 4:40,4,40,9,-0.956034312,negative,-1
635,5,3546881,"OMG Amazing!!!!!! I had the duck, and my boyfriend had the elk. I had the server pair a wine for me to go with the food, and it was perfect match! I cant wait to take my family there when they come to visit!","['French Restaurant', 'American Restaurant', 'Diner']",4578732,1382147324,10/18/2013,"[34.510858, -118.35582]",$,10/19/2013 1:48,1,48,44,0.959442199,positive,1
636,4,8695530,"It is always good to visit this place. The service is good, the food is good, and the prices are even better.","['Coffee Shop', 'Tea House']",6074569,1386276924,12/5/2013,"[34.191136, -118.602465]",$$,12/5/2013 20:55,20,55,24,0.665952598,positive,1
637,2,6465335,"Worst service I have ever had! Drinks are overpriced and hardly worth it, and the salad comes out warmer than the wings. About  30 min wait for someone to notice you haven't ordered yet.","['Chicken Restaurant', 'Chicken Wings Restaurant', 'American Restaurant']",3548570,1362216582,3/2/2013,"[34.104615, -117.537604]",$$$,3/2/2013 9:29,9,29,42,-0.969685311,negative,-1
638,1,6465335,"I am a BBQ enthusiast, but this place was by far the worse place to have BBQ food we have ever been to. A shame to call itself such a place. The filet mignon was anything but the name, it more of resembled a cheap butter steak you find in the frozen food aisle. Everything was flavorless and bland, if i order garlic mashed potatoes, i expect to get garlic in the mashed potatoes, or at least a hint of garlic flavor to them. DO NOT EVEN CONSIDER SPENDING A DIME HERE!!!! Overpriced and terrible quality. I expect even mediocre food for that price, would have been better off going to a McDonalds. You have been warned.","['Barbecue Restaurant', 'Steak House', 'Cocktail Bar']",6501017,1377404901,8/24/2013,"[37.651347, -118.986319]",$$,8/25/2013 4:28,4,28,21,-0.920703772,negative,-1
639,3,2306117,"Very good drinks...poor to average food.  I had the bone in Ribeye steak which came oversalted and I went Surf/Turf with some scallops....why did they put two individual dinners on one plate is beyond me.....so presentation on the palte sucked. My wife had the grilled salmon salad which she said was pretty good, salmon wasa bit overcooked (dry) but otherwise good.  I would not recommend coming here especially for the price.","['Seafood Restaurant', 'Steak House', 'Lounge']",6821561,1347121801,9/8/2012,"[33.603897, -117.874002]",$$,9/8/2012 16:30,16,30,1,-0.262016815,neutral,0
640,5,1194741,"The concept here is really cool, great unique ideas for food, and awesome drinks!","['Restaurant', 'American Restaurant', 'Caterer']",6452704,1377805751,8/29/2013,"[37.774041, -122.424244]",$$,8/29/2013 19:49,19,49,11,0.935683034,positive,1
641,5,1330334,"Awesone resturant, delicioso comida","['Latin American Restaurant', 'Mexican Restaurant']",2704564,1381696760,10/13/2013,"[33.782307, -118.309598]",$$$,10/13/2013 20:39,20,39,20,0.813809306,positive,1
642,5,1330334,Very friendly awesome coustomer service good food resonable price,['Breakfast Restaurant'],7993954,1370187611,6/2/2013,"[33.734101, -118.292464]",$$,6/2/2013 15:40,15,40,11,0.855680447,positive,1
